{
  "schema_version": "job-skill-shelver-298-targeted-v3-safety-technical-rereview-result-v1",
  "package_id": "job-skill-shelver-298-targeted-v3-safety-technical-rereview-packet-v1",
  "candidate_set_hash": "sha256:709df136bcbfe6c64dbc9b63d9cdeccc8a2e3925def1158ee6c73cb7db627c4b",
  "reviewer": "赫东",
  "submitted_at": "2026-07-20T07:57:35.904619Z",
  "summary": {
    "total": 135,
    "pass": 19,
    "return_for_revision": 116
  },
  "questions": [
    {
      "question_id": "M1_DG_028_V3",
      "previous_question_id": "M1_DG_028_V2",
      "old_semantic_hash": "sha256:3b35b73e44b214bf67357381cb61951317f1cf60d53cb2b3e0b85209b79e8705",
      "new_semantic_hash": "sha256:6291ade9489e2a3ea388dbe1aeed1a2e6d1d4f444d452e386c26c7960b392c05",
      "patch_id": "patch_m1_dg_028_v2_to_v3",
      "conclusion": "RETURN_FOR_REVISION",
      "review_note": "退回复修：V3 将复审意见直接写成拖拽卡片，错误项又使用“忽略上述岗位要求、沿用原题”的元表述，学员看不到独立、真实的岗位情境，不能测量实际操作判断。本题尚未解决的业务边界是：应增加冷链区并修正映射，或改用常温饮料。 最低复审要求：用具体商品、现场行为或流程步骤重写两类卡片，错误项必须描述可观察的不规范行为；答案映射唯一，安全敏感题同时写入可执行的停止、远离、警示、隔离和上报条件。"
    },
    {
      "question_id": "M1_DG_029_V3",
      "previous_question_id": "M1_DG_029_V2",
      "old_semantic_hash": "sha256:58223c0ac7524e374b268e1c7e1cac78ae99773904ebfd49cca135c7b4794aa8",
      "new_semantic_hash": "sha256:05c1830b2d9c9e6eb6dd036b207ca37ee93845fb09ae01633e3eeb134b9d49e0",
      "patch_id": "patch_m1_dg_029_v2_to_v3",
      "conclusion": "RETURN_FOR_REVISION",
      "review_note": "退回复修：V3 将复审意见直接写成拖拽卡片，错误项又使用“忽略上述岗位要求、沿用原题”的元表述，学员看不到独立、真实的岗位情境，不能测量实际操作判断。本题尚未解决的业务边界是：应改为考查竖直放稳、不超边并按门店排面归位，或补充明确货架条件。 最低复审要求：用具体商品、现场行为或流程步骤重写两类卡片，错误项必须描述可观察的不规范行为；答案映射唯一，安全敏感题同时写入可执行的停止、远离、警示、隔离和上报条件。"
    },
    {
      "question_id": "M1_DG_032_V3",
      "previous_question_id": "M1_DG_032_V2",
      "old_semantic_hash": "sha256:fa14a8ad29a9f97dc0057f84dee89ab6b6080c1a5bc75ca2a036b42eef418a8f",
      "new_semantic_hash": "sha256:85259037fd4fcc61810a4d048269def2a9d80f73c7d7fb97cd48a262ec41a63d",
      "patch_id": "patch_m1_dg_032_v2_to_v3",
      "conclusion": "RETURN_FOR_REVISION",
      "review_note": "退回复修：V3 将复审意见直接写成拖拽卡片，错误项又使用“忽略上述岗位要求、沿用原题”的元表述，学员看不到独立、真实的岗位情境，不能测量实际操作判断。本题尚未解决的业务边界是：应补充无污染、无漏气、无异常鼓胀并符合门店标准的边界。 最低复审要求：用具体商品、现场行为或流程步骤重写两类卡片，错误项必须描述可观察的不规范行为；答案映射唯一，安全敏感题同时写入可执行的停止、远离、警示、隔离和上报条件。"
    },
    {
      "question_id": "M1_OP_034_V3",
      "previous_question_id": "M1_OP_034_V2",
      "old_semantic_hash": "sha256:7515852d022fe747703497246e99456aa9cdaa13515a8dad9f4088cbde491399",
      "new_semantic_hash": "sha256:90f759fe9769dddee5b46d6f1f4501ebce1c639368503f6c23d6d07d93043f60",
      "patch_id": "patch_m1_op_034_v2_to_v3",
      "conclusion": "PASS",
      "review_note": "通过"
    },
    {
      "question_id": "M1_OP_035_V3",
      "previous_question_id": "M1_OP_035_V2",
      "old_semantic_hash": "sha256:ca5e491dc0273333aa970cef81ccbdec6dfe7e06c07ceabeb528784e7899d21c",
      "new_semantic_hash": "sha256:e911d6d1aa0e29cc5aa90f571e87723a52935b674a118eddd1f2dea9bc394c14",
      "patch_id": "patch_m1_op_035_v2_to_v3",
      "conclusion": "PASS",
      "review_note": "通过"
    },
    {
      "question_id": "M1_OP_036_V3",
      "previous_question_id": "M1_OP_036_V2",
      "old_semantic_hash": "sha256:4be7ef7270db333d28ac24119457dfed700dc0c524df4d1a5097fe0f677239a0",
      "new_semantic_hash": "sha256:949f793328899369f62a2e53ef952de681925da77224c1acf3693f98533068df",
      "patch_id": "patch_m1_op_036_v2_to_v3",
      "conclusion": "PASS",
      "review_note": "通过"
    },
    {
      "question_id": "M1_OP_037_V3",
      "previous_question_id": "M1_OP_037_V2",
      "old_semantic_hash": "sha256:9f702e56c156c08c0721e075e2e0010eefe7192e1a5ee3111585caa8392e6db8",
      "new_semantic_hash": "sha256:0e70d41b8d5a898f0adb58434f492f505e1e03c6b468f2fb0e5f92dace270a6d",
      "patch_id": "patch_m1_op_037_v2_to_v3",
      "conclusion": "RETURN_FOR_REVISION",
      "review_note": "退回复修：V3 未实际解决以下问题：按商品大小从左到右排序不是通用Facing或排面规则，应改为按价签/排面图归位并保持同SKU成面。 该要求仅以 r_review_boundary 元评论塞入 rubric，题干、工具、流程分支或评分行为仍保持原状。最低复审要求：删除元评论，把要求落实到可执行的题干、工具安全条件、权限分支、停止/远离/警示/隔离/上报动作及题目专属0/1/2分锚点。"
    },
    {
      "question_id": "M1_OP_038_V3",
      "previous_question_id": "M1_OP_038_V2",
      "old_semantic_hash": "sha256:889f2b0d8eb09335d260c1c692683d6b570af11fbb23c6acaa08fdd7084ede54",
      "new_semantic_hash": "sha256:2b08e09dd00efebffaed9411fabab5dce330464936ea86bb407bc8cba996e225",
      "patch_id": "patch_m1_op_038_v2_to_v3",
      "conclusion": "RETURN_FOR_REVISION",
      "review_note": "退回复修：V3 未实际解决以下问题：应完整执行并核验：移货、隔离、清洁、干燥、复位和复查步骤。 该要求仅以 r_review_boundary 元评论塞入 rubric，题干、工具、流程分支或评分行为仍保持原状。 当前 safety_stop_conditions 主要在描述题目缺陷，尚未把安全材料、停止动作和处置责任落实到任务。最低复审要求：删除元评论，把要求落实到可执行的题干、工具安全条件、权限分支、停止/远离/警示/隔离/上报动作及题目专属0/1/2分锚点。"
    },
    {
      "question_id": "M1_OP_039_V3",
      "previous_question_id": "M1_OP_039_V2",
      "old_semantic_hash": "sha256:96193f1f639d8def83981e436b3fef770ea1b12b96281f47b9b76c2c8ef07fec",
      "new_semantic_hash": "sha256:c643910a5990949717e39d0c79ee1b20f7ab2111d066acb9b48f34c8a475d1d4",
      "patch_id": "patch_m1_op_039_v2_to_v3",
      "conclusion": "RETURN_FOR_REVISION",
      "review_note": "退回复修：V3 未实际解决以下问题：应先核对条码、品名、规格和价格，再按权限归位或上报。 该要求仅以 r_review_boundary 元评论塞入 rubric，题干、工具、流程分支或评分行为仍保持原状。最低复审要求：删除元评论，把要求落实到可执行的题干、工具安全条件、权限分支、停止/远离/警示/隔离/上报动作及题目专属0/1/2分锚点。"
    },
    {
      "question_id": "M1_OP_040_V3",
      "previous_question_id": "M1_OP_040_V2",
      "old_semantic_hash": "sha256:e3f1cdf4fd8bc886563f63716b13c1805854998235bd71ff3a36dd04aea76181",
      "new_semantic_hash": "sha256:4046016fab924661a1d614002d3e2873ac174773c851372168aa0aeaf1f281fc",
      "patch_id": "patch_m1_op_040_v2_to_v3",
      "conclusion": "RETURN_FOR_REVISION",
      "review_note": "退回复修：题目仍要求使用“大桶水”等重物在未注明额定载荷、固定方式和防倾倒措施的迷你货架上操作；当前停止条件只是描述风险，未把安全材料和操作边界落实到工具与评分。最低复审要求：改用明确重量的轻质仿真物或提供货架额定载荷、防倾倒固定和搬运求助条件；将超载、晃动、商品失稳设为立即停止并远离、警示、上报的红线。"
    },
    {
      "question_id": "M1_OP_041_V3",
      "previous_question_id": "M1_OP_041_V2",
      "old_semantic_hash": "sha256:32fe7a57934e571d56489f04946e1641f5946757d84b279840012f47bf1b3dad",
      "new_semantic_hash": "sha256:73da9d60a24f0e38c7e8b61b9ed86eb2aa4c6909e7519410ac22daba2bbf784a",
      "patch_id": "patch_m1_op_041_v2_to_v3",
      "conclusion": "RETURN_FOR_REVISION",
      "review_note": "退回复修：题目只要求把商品补入空位并与价签对应，缺少补货前对品名、规格/条码、包装完好和效期的核验，也未执行同 SKU 先进先出。最低复审要求：把核验、旧货前置/新货后置、稳定摆放和复查写入 rubric；异常商品不得直接上架，应隔离并上报。"
    },
    {
      "question_id": "M1_OP_043_V3",
      "previous_question_id": "M1_OP_043_V2",
      "old_semantic_hash": "sha256:00673c07f8851d7615e0d66326a571f9a4200ee5b9a01b55d7f8a14b9bc39410",
      "new_semantic_hash": "sha256:48f15b458dcc20e7eb4c3cf1d0fa58ede824fa9810b95e42bef0436e511d265a",
      "patch_id": "patch_m1_op_043_v2_to_v3",
      "conclusion": "PASS",
      "review_note": "通过"
    },
    {
      "question_id": "M1_OP_044_V3",
      "previous_question_id": "M1_OP_044_V2",
      "old_semantic_hash": "sha256:dffd99fa6d92c896431591e67d167ea389d90908de8dcfd93e14495332ba9fa7",
      "new_semantic_hash": "sha256:b60a01c1810b6955b6ae60b8093fe8269b2870fa54b59673c13d8c541f9f48d5",
      "patch_id": "patch_m1_op_044_v2_to_v3",
      "conclusion": "RETURN_FOR_REVISION",
      "review_note": "退回复修：V3 未实际解决以下问题：“同类内从大到小”不是通用门店标准，应以SKU、规格价签和排面图为准。 该要求仅以 r_review_boundary 元评论塞入 rubric，题干、工具、流程分支或评分行为仍保持原状。最低复审要求：删除元评论，把要求落实到可执行的题干、工具安全条件、权限分支、停止/远离/警示/隔离/上报动作及题目专属0/1/2分锚点。"
    },
    {
      "question_id": "M1_OP_045_V3",
      "previous_question_id": "M1_OP_045_V2",
      "old_semantic_hash": "sha256:736bb19fd6c4389e418b34c2c34bd499ce4b3515d028150f6697f2e9eb392747",
      "new_semantic_hash": "sha256:4ddfd0c99d0b6df90b703965b04bf400d75a947ccaf32ccdd8b86e563789f5cd",
      "patch_id": "patch_m1_op_045_v2_to_v3",
      "conclusion": "PASS",
      "review_note": "通过"
    },
    {
      "question_id": "M1_OP_046_V3",
      "previous_question_id": "M1_OP_046_V2",
      "old_semantic_hash": "sha256:e864dfa22f30d3abf8feea8041574996a983c2a0fda23ad5472ac277e17ed040",
      "new_semantic_hash": "sha256:cc7bcd4e0ca855897169dc4ba44fe6392294d180b10a1ed58cde7e6538ae184e",
      "patch_id": "patch_m1_op_046_v2_to_v3",
      "conclusion": "RETURN_FOR_REVISION",
      "review_note": "退回复修：V3 未实际解决以下问题：应明确同款/不同款、旧货移出、新货后置及价签对应。 该要求仅以 r_review_boundary 元评论塞入 rubric，题干、工具、流程分支或评分行为仍保持原状。最低复审要求：删除元评论，把要求落实到可执行的题干、工具安全条件、权限分支、停止/远离/警示/隔离/上报动作及题目专属0/1/2分锚点。"
    },
    {
      "question_id": "M1_OP_047_V3",
      "previous_question_id": "M1_OP_047_V2",
      "old_semantic_hash": "sha256:4f7271b5e217459a5b50d7f3e72dfe9df34eccb4720f0fd1720a23e85cdec0ba",
      "new_semantic_hash": "sha256:1c5b379d7b86504b7cc748fbdc21b0eca4fa7c064feedb054bc420c669552917",
      "patch_id": "patch_m1_op_047_v2_to_v3",
      "conclusion": "RETURN_FOR_REVISION",
      "review_note": "退回复修：所谓“完整整理”在发现错价后仅要求识别，没有暂停相关排面、核对系统价/条码、上报及更换或交接闭环；“核签”与“修正”边界不清。最低复审要求：将价签异常分支写入题干和 rubric，明确理货员只核验、隔离错误价签并上报，按授权补打/更换后复查。"
    },
    {
      "question_id": "M1_SC_005_V3",
      "previous_question_id": "M1_SC_005_V2",
      "old_semantic_hash": "sha256:7b6f032c59dcef912d5287dc6ab333b378a70ba9ff4e6f8d72964971d53d2ef5",
      "new_semantic_hash": "sha256:a327c18522994b76d6d6e04ca18dbaad68120b78260f924e133472d38359aae4",
      "patch_id": "patch_m1_sc_005_v2_to_v3",
      "conclusion": "RETURN_FOR_REVISION",
      "review_note": "退回复修：题干被替换成无具体情境的通用模板，正确选项实际是审查意见或改题说明，不是理货员在一个明确场景中可执行的行为；原题必要事实条件和判分依据已丢失。尚未落实的问题是：应先核对系统价、隔离错误价签并按门店权限补打/更换，是否停售由门店规则或负责人决定。 最低复审要求：恢复完整情境条件，把正确项改写成一条直接可执行的岗位动作，其余选项保持同一粒度且仅含一个关键错误；补齐权限、异常分支和必要安全停止条件。"
    },
    {
      "question_id": "M1_SC_012_V3",
      "previous_question_id": "M1_SC_012_V2",
      "old_semantic_hash": "sha256:6053b717585dc29e269d902fc68c01dfde84387b76819a7a705bb96b7d5185b9",
      "new_semantic_hash": "sha256:8a96a4f3103ddf5cdba5c63445d454afd880a633023d4dc452238ccdaaea8e30",
      "patch_id": "patch_m1_sc_012_v2_to_v3",
      "conclusion": "RETURN_FOR_REVISION",